<!ELEMENT note (to+,from,heading*,main)>
<!ELEMENT to      (#PCDATA)>
<!ELEMENT from    (#PCDATA)>
<!ELEMENT heading (#PCDATA)>
<!ELEMENT main   (#PCDATA)>

