<?xml version="1.0" ?> 
<!DOCTYPE note SYSTEM "sample.dtd" >
<note>
<to>Ali</to> 
<from>Hasan</from> 
<heading>test</heading>
<heading>test</heading>
<heading>test</heading>
<heading>test</heading>
<heading>test</heading>
<main>This is message</main>
</note>
